{
  "$schema": "https://json-schema.org/draft/2020-12/schema",
  "title": "Book",
  "description": "A published book or monograph.",
  "type": "object",
  "required": ["title", "authors", "isbn", "publishedDate"],
  "properties": {
    "title": {
      "type": "string",
      "minLength": 1,
      "maxLength": 300
    },
    "subtitle": {
      "type": "string",
      "maxLength": 500
    },
    "authors": {
      "type": "array",
      "minItems": 1,
      "items": {
        "type": "string",
        "minLength": 1
      }
    },
    "isbn": {
      "type": "string",
      "format": "isbn-13",
      "description": "ISBN-13 with or without hyphens. betto_schema validates the GS1 prefix and check digit."
    },
    "doi": {
      "type": "string",
      "format": "doi",
      "description": "Digital Object Identifier, e.g. 10.1234/suffix. betto_schema extension format."
    },
    "publishedDate": {
      "type": "string",
      "format": "date",
      "description": "Publication date in YYYY-MM-DD format (RFC 3339)."
    },
    "publisher": {
      "type": "string",
      "minLength": 1
    },
    "edition": {
      "type": "integer",
      "minimum": 1
    },
    "language": {
      "type": "string",
      "format": "lang",
      "description": "BCP 47 / RFC 5646 language tag, e.g. 'en' or 'zh-Hant'."
    },
    "pageCount": {
      "type": "integer",
      "minimum": 1
    },
    "genres": {
      "type": "array",
      "items": {
        "type": "string",
        "enum": [
          "art",
          "biography",
          "fiction",
          "history",
          "non-fiction",
          "philosophy",
          "science",
          "technology"
        ]
      }
    }
  },
  "additionalProperties": false
}
