{
  "title": "Structure and Interpretation of Computer Programs",
  "subtitle": "Second Edition",
  "authors": ["Harold Abelson", "Gerald Jay Sussman"],
  "isbn": "978-0-262-51087-5",
  "doi": "10.7551/mitpress/9077.001.0001",
  "publishedDate": "1996-07-25",
  "publisher": "MIT Press",
  "edition": 2,
  "language": "en",
  "pageCount": 657,
  "genres": ["technology", "science"]
}
